{
  "$schema": "https://schemas.deszo.local/epub_content_extractor_test_coverage_manifest.v3.0.schema.json",
  "manifest_version": "epub_content_extractor_test_coverage_manifest.v3.0",
  "result_schema_version": "epub_content_extractor.v3.0",
  "path_base": "repo_root",
  "tests": [
    {
      "test_id": "TC-001",
      "priority": "P0",
      "fixture_id": "F001",
      "fixture_source": "committed_golden",
      "fixture_path": "tests/fixtures/epub_content_extractor/success/minimal_valid/fixture.json",
      "expected_output_path": "tests/fixtures/epub_content_extractor/success/minimal_valid/expected.normalized.json",
      "assertion_mode": "exact_golden",
      "blocking_status": "ready",
      "notes": "Minimal valid library output."
    },
    {
      "test_id": "TC-002",
      "priority": "P0",
      "fixture_id": "F001",
      "fixture_source": "committed_golden",
      "fixture_path": "tests/fixtures/epub_content_extractor/success/minimal_valid/fixture.json",
      "expected_output_path": "tests/fixtures/epub_content_extractor/success/minimal_valid/expected.normalized.json",
      "assertion_mode": "cli_contract",
      "blocking_status": "ready",
      "notes": "CLI stdout must parse to equivalent success result."
    },
    {
      "test_id": "TC-003",
      "priority": "P0",
      "fixture_id": "F001",
      "fixture_source": "committed_golden",
      "fixture_path": "tests/fixtures/epub_content_extractor/success/minimal_valid/fixture.json",
      "expected_output_path": "tests/fixtures/epub_content_extractor/success/minimal_valid/expected.normalized.json",
      "assertion_mode": "schema_valid",
      "blocking_status": "ready",
      "notes": "Success result schema validation."
    },
    {
      "test_id": "TC-004",
      "priority": "P0",
      "fixture_id": "F001",
      "fixture_source": "committed_golden",
      "fixture_path": "tests/fixtures/epub_content_extractor/success/minimal_valid/fixture.json",
      "expected_output_path": "tests/fixtures/epub_content_extractor/success/minimal_valid/expected.normalized.json",
      "assertion_mode": "invariant",
      "blocking_status": "ready",
      "notes": "Default effective config equals F000."
    },
    {
      "test_id": "TC-005",
      "priority": "P0",
      "fixture_id": "F018",
      "fixture_source": "inline_fixture",
      "fixture_path": null,
      "expected_output_path": null,
      "assertion_mode": "invariant",
      "blocking_status": "ready",
      "notes": "Inline config fixture; success output must omit input-only $schema."
    },
    {
      "test_id": "TC-006",
      "priority": "P0",
      "fixture_id": "F016",
      "fixture_source": "committed_golden",
      "fixture_path": "tests/fixtures/epub_content_extractor/config/unknown_field/fixture.json",
      "expected_output_path": "tests/fixtures/epub_content_extractor/config/unknown_field/expected.normalized.json",
      "assertion_mode": "exact_golden",
      "blocking_status": "ready",
      "notes": "Unknown config field failure."
    },
    {
      "test_id": "TC-007",
      "priority": "P0",
      "fixture_id": "F017",
      "fixture_source": "inline_fixture",
      "fixture_path": null,
      "expected_output_path": null,
      "assertion_mode": "error_code",
      "blocking_status": "ready",
      "notes": "Inline invalid config with numeric string."
    },
    {
      "test_id": "TC-008",
      "priority": "P1",
      "fixture_id": "F019",
      "fixture_source": "inline_fixture",
      "fixture_path": null,
      "expected_output_path": null,
      "assertion_mode": "invariant",
      "blocking_status": "ready",
      "notes": "Inline max-boundary config accepted."
    },
    {
      "test_id": "TC-009",
      "priority": "P1",
      "fixture_id": "F020",
      "fixture_source": "inline_fixture",
      "fixture_path": null,
      "expected_output_path": null,
      "assertion_mode": "error_code",
      "blocking_status": "ready",
      "notes": "Inline above-maximum config rejected."
    },
    {
      "test_id": "TC-010",
      "priority": "P0",
      "fixture_id": null,
      "fixture_source": "no_fixture_required",
      "fixture_path": null,
      "expected_output_path": null,
      "assertion_mode": "error_code",
      "blocking_status": "ready",
      "notes": "Temporary missing path created by test harness."
    },
    {
      "test_id": "TC-011",
      "priority": "P0",
      "fixture_id": null,
      "fixture_source": "no_fixture_required",
      "fixture_path": null,
      "expected_output_path": null,
      "assertion_mode": "error_code",
      "blocking_status": "ready",
      "notes": "Temporary directory created by test harness."
    },
    {
      "test_id": "TC-012",
      "priority": "P0",
      "fixture_id": null,
      "fixture_source": "no_fixture_required",
      "fixture_path": null,
      "expected_output_path": null,
      "assertion_mode": "exception",
      "blocking_status": "ready",
      "notes": "Direct API programmer-error call."
    },
    {
      "test_id": "TC-013",
      "priority": "P0",
      "fixture_id": "F011",
      "fixture_source": "committed_golden",
      "fixture_path": "tests/fixtures/epub_content_extractor/failure/plain_text_epub_extension/fixture.json",
      "expected_output_path": "tests/fixtures/epub_content_extractor/failure/plain_text_epub_extension/expected.normalized.json",
      "assertion_mode": "exact_golden",
      "blocking_status": "ready",
      "notes": "Plain text .epub rejected."
    },
    {
      "test_id": "TC-014",
      "priority": "P0",
      "fixture_id": "F012",
      "fixture_source": "committed_golden",
      "fixture_path": "tests/fixtures/epub_content_extractor/failure/valid_zip_not_epub/fixture.json",
      "expected_output_path": "tests/fixtures/epub_content_extractor/failure/valid_zip_not_epub/expected.normalized.json",
      "assertion_mode": "exact_golden",
      "blocking_status": "ready",
      "notes": "ZIP without EPUB package metadata."
    },
    {
      "test_id": "TC-015",
      "priority": "P0",
      "fixture_id": "F013",
      "fixture_source": "committed_golden",
      "fixture_path": "tests/fixtures/epub_content_extractor/security/path_traversal/fixture.json",
      "expected_output_path": "tests/fixtures/epub_content_extractor/security/path_traversal/expected.normalized.json",
      "assertion_mode": "exact_golden",
      "blocking_status": "ready",
      "notes": "Archive traversal precedence."
    },
    {
      "test_id": "TC-016",
      "priority": "P1",
      "fixture_id": "F014",
      "fixture_source": "inline_fixture",
      "fixture_path": null,
      "expected_output_path": null,
      "assertion_mode": "error_code",
      "blocking_status": "ready",
      "notes": "Inline excessive ZIP entry-count fixture."
    },
    {
      "test_id": "TC-017",
      "priority": "P1",
      "fixture_id": "F015",
      "fixture_source": "fault_injection",
      "fixture_path": null,
      "expected_output_path": null,
      "assertion_mode": "fault_injection",
      "blocking_status": "ready",
      "notes": "Deterministic archive-safety calculator test for compression ratio."
    },
    {
      "test_id": "TC-018",
      "priority": "P0",
      "fixture_id": "F021",
      "fixture_source": "inline_fixture",
      "fixture_path": null,
      "expected_output_path": null,
      "assertion_mode": "error_code",
      "blocking_status": "ready",
      "notes": "Inline file-size limit test derived from generated F001 bytes."
    },
    {
      "test_id": "TC-019",
      "priority": "P0",
      "fixture_id": "F003",
      "fixture_source": "inline_fixture",
      "fixture_path": null,
      "expected_output_path": null,
      "assertion_mode": "invariant",
      "blocking_status": "ready",
      "notes": "Inline missing metadata EPUB fixture."
    },
    {
      "test_id": "TC-020",
      "priority": "P0",
      "fixture_id": "F004",
      "fixture_source": "inline_fixture",
      "fixture_path": null,
      "expected_output_path": null,
      "assertion_mode": "invariant",
      "blocking_status": "ready",
      "notes": "Inline non-English metadata language fixture."
    },
    {
      "test_id": "TC-021",
      "priority": "P1",
      "fixture_id": "F005",
      "fixture_source": "inline_fixture",
      "fixture_path": null,
      "expected_output_path": null,
      "assertion_mode": "invariant",
      "blocking_status": "ready",
      "notes": "Inline invalid date metadata fixture."
    },
    {
      "test_id": "TC-022",
      "priority": "P1",
      "fixture_id": "F006",
      "fixture_source": "inline_fixture",
      "fixture_path": null,
      "expected_output_path": null,
      "assertion_mode": "invariant",
      "blocking_status": "ready",
      "notes": "Inline duplicate metadata fixture."
    },
    {
      "test_id": "TC-023",
      "priority": "P1",
      "fixture_id": "F007",
      "fixture_source": "inline_fixture",
      "fixture_path": null,
      "expected_output_path": null,
      "assertion_mode": "invariant",
      "blocking_status": "ready",
      "notes": "Inline ambiguous author fixture."
    },
    {
      "test_id": "TC-024",
      "priority": "P1",
      "fixture_id": "F002",
      "fixture_source": "committed_golden",
      "fixture_path": "tests/fixtures/epub_content_extractor/success/complex_valid/fixture.json",
      "expected_output_path": "tests/fixtures/epub_content_extractor/success/complex_valid/expected.normalized.json",
      "assertion_mode": "exact_golden",
      "blocking_status": "ready",
      "notes": "Complex valid golden."
    },
    {
      "test_id": "TC-025",
      "priority": "P1",
      "fixture_id": "F008",
      "fixture_source": "inline_fixture",
      "fixture_path": null,
      "expected_output_path": null,
      "assertion_mode": "invariant",
      "blocking_status": "ready",
      "notes": "Inline duplicate footnote marker fixture."
    },
    {
      "test_id": "TC-026",
      "priority": "P1",